"No.","Time","Source","Destination","Protocol","Length","Info"
"1","0.000000","2601:19b:681:6a0:443d:6eeb:d343:8f85","2a03:2880:f07e:d:face:b00c:0:6206","TCP","1466","58062  >  443 [ACK] Seq=1 Ack=1 Win=2048 Len=1380 TSval=3284624637 TSecr=2563022075 [TCP PDU reassembled in 5]"
"2","0.000006","2601:19b:681:6a0:443d:6eeb:d343:8f85","2a03:2880:f07e:d:face:b00c:0:6206","TCP","1466","58062  >  443 [ACK] Seq=1381 Ack=1 Win=2048 Len=1380 TSval=3284624637 TSecr=2563022075 [TCP PDU reassembled in 5]"
"3","0.000011","2601:19b:681:6a0:443d:6eeb:d343:8f85","2a03:2880:f07e:d:face:b00c:0:6206","TCP","1466","58062  >  443 [ACK] Seq=2761 Ack=1 Win=2048 Len=1380 TSval=3284624637 TSecr=2563022075 [TCP PDU reassembled in 5]"
"4","0.000012","2601:19b:681:6a0:443d:6eeb:d343:8f85","2a03:2880:f07e:d:face:b00c:0:6206","TCP","1466","58062  >  443 [ACK] Seq=4141 Ack=1 Win=2048 Len=1380 TSval=3284624637 TSecr=2563022075 [TCP PDU reassembled in 5]"
"5","0.000174","2601:19b:681:6a0:443d:6eeb:d343:8f85","2a03:2880:f07e:d:face:b00c:0:6206","TLSv1.2","976","Application Data"
"6","0.021129","2a03:2880:f07e:d:face:b00c:0:6206","2601:19b:681:6a0:443d:6eeb:d343:8f85","TCP","86","443  >  58062 [ACK] Seq=1 Ack=6411 Win=2013 Len=0 TSval=2563025410 TSecr=3284624637"
"7","0.032761","2a03:2880:f07e:d:face:b00c:0:6206","2601:19b:681:6a0:443d:6eeb:d343:8f85","TLSv1.2","118","Application Data"
"8","0.033038","2601:19b:681:6a0:443d:6eeb:d343:8f85","2a03:2880:f07e:d:face:b00c:0:6206","TCP","86","58062  >  443 [ACK] Seq=6411 Ack=33 Win=2047 Len=0 TSval=3284624670 TSecr=2563025423"
"9","0.052903","2a03:2880:f07e:d:face:b00c:0:6206","2601:19b:681:6a0:443d:6eeb:d343:8f85","TLSv1.2","129","Application Data"
"10","0.053299","2601:19b:681:6a0:443d:6eeb:d343:8f85","2a03:2880:f07e:d:face:b00c:0:6206","TCP","86","58062  >  443 [ACK] Seq=6411 Ack=76 Win=2047 Len=0 TSval=3284624690 TSecr=2563025445"
"11","0.057030","2601:19b:681:6a0:443d:6eeb:d343:8f85","2a03:2880:f07e:d:face:b00c:0:6206","TLSv1.2","122","Application Data"
"12","0.113778","2a03:2880:f07e:d:face:b00c:0:6206","2601:19b:681:6a0:443d:6eeb:d343:8f85","TCP","86","443  >  58062 [ACK] Seq=76 Ack=6447 Win=2038 Len=0 TSval=2563025506 TSecr=3284624694"
"13","0.534624","157.240.245.61","10.0.0.147","TCP","105","5222  >  63822 [PSH, ACK] Seq=1 Ack=1 Win=293 Len=39 TSval=360503197 TSecr=27590617"
"14","0.535236","10.0.0.147","157.240.245.61","TCP","66","63822  >  5222 [ACK] Seq=1 Ack=40 Win=2047 Len=0 TSval=27680726 TSecr=360503197"
"15","0.538408","10.0.0.147","157.240.245.61","TCP","95","63822  >  5222 [PSH, ACK] Seq=1 Ack=40 Win=2048 Len=29 TSval=27680729 TSecr=360503197"
"16","0.550173","157.240.245.61","10.0.0.147","TCP","66","5222  >  63822 [ACK] Seq=40 Ack=30 Win=293 Len=0 TSval=360503290 TSecr=27680729"
"17","0.551838","157.240.245.61","10.0.0.147","TCP","66","[TCP Dup ACK 16#1] 5222  >  63822 [ACK] Seq=40 Ack=30 Win=293 Len=0 TSval=360503290 TSecr=27680729"
"18","0.808582","2601:19b:681:6a0:443d:6eeb:d343:8f85","2001:558:feed::1","DNS","98","Standard query 0xb4e0 AAAA mask.apple-dns.net"
"19","0.808787","2601:19b:681:6a0:443d:6eeb:d343:8f85","2001:558:feed::1","DNS","98","Standard query 0x8439 A mask.apple-dns.net"
"20","0.814542","2601:19b:681:6a0:443d:6eeb:d343:8f85","2620:149:a41:109::b","QUIC","1412","Initial, DCID=aafc6f683af1543e, SCID=b73eeb1283210ec8, PKN: 0, CRYPTO, PADDING"
"21","0.831343","2001:558:feed::1","2601:19b:681:6a0:443d:6eeb:d343:8f85","DNS","322","Standard query response 0xb4e0 AAAA mask.apple-dns.net AAAA 2620:149:a41:109::b AAAA 2620:149:a41:100::9 AAAA 2620:149:a41:100::5 AAAA 2620:149:a41:109::7 AAAA 2620:149:a41:100::4 AAAA 2620:149:a41:100::7 AAAA 2620:149:a41:109::5 AAAA 2620:149:a41:109::6"
"22","0.836871","2001:558:feed::1","2601:19b:681:6a0:443d:6eeb:d343:8f85","DNS","226","Standard query response 0x8439 A mask.apple-dns.net A 17.248.138.136 A 17.248.138.133 A 17.248.254.103 A 17.248.254.107 A 17.248.254.100 A 17.248.138.132 A 17.248.254.104 A 17.248.138.135"
"23","0.837246","2620:149:a41:109::b","2601:19b:681:6a0:443d:6eeb:d343:8f85","QUIC","1262","Handshake, DCID=b73eeb1283210ec8, SCID=387c1b349fb9402c0e1ae10db5522d81ec2adf44"
"24","0.839456","2601:19b:681:6a0:443d:6eeb:d343:8f85","2620:149:a41:109::b","QUIC","176","Handshake, DCID=387c1b349fb9402c0e1ae10db5522d81ec2adf44, SCID=b73eeb1283210ec8"
"25","0.839461","2601:19b:681:6a0:443d:6eeb:d343:8f85","2620:149:a41:109::b","QUIC","1412","Initial, DCID=387c1b349fb9402c0e1ae10db5522d81ec2adf44, SCID=b73eeb1283210ec8, PKN: 1, ACK, PADDING"
"26","0.841440","2601:19b:681:6a0:443d:6eeb:d343:8f85","2620:149:a41:109::b","QUIC","787","Protected Payload (KP0), DCID=387c1b349fb9402c0e1ae10db5522d81ec2adf44"
"27","0.841616","2601:19b:681:6a0:443d:6eeb:d343:8f85","2620:149:a41:109::b","QUIC","184","Protected Payload (KP0), DCID=387c1b349fb9402c0e1ae10db5522d81ec2adf44"
"28","0.859268","2620:149:a41:109::b","2601:19b:681:6a0:443d:6eeb:d343:8f85","QUIC","881","Protected Payload (KP0), DCID=b73eeb1283210ec8"
"29","0.861066","2620:149:a41:109::b","2601:19b:681:6a0:443d:6eeb:d343:8f85","QUIC","94","Protected Payload (KP0), DCID=b73eeb1283210ec8"
"30","0.861068","2620:149:a41:109::b","2601:19b:681:6a0:443d:6eeb:d343:8f85","QUIC","94","Protected Payload (KP0), DCID=b73eeb1283210ec8"
"31","0.861069","2620:149:a41:109::b","2601:19b:681:6a0:443d:6eeb:d343:8f85","QUIC","119","Protected Payload (KP0), DCID=b73eeb1283210ec8"
"32","0.861446","2601:19b:681:6a0:443d:6eeb:d343:8f85","2620:149:a41:109::b","QUIC","105","Protected Payload (KP0), DCID=387c1b349fb9402c0e1ae10db5522d81ec2adf44"
"33","0.861450","2601:19b:681:6a0:443d:6eeb:d343:8f85","2620:149:a41:132::2:3","TCP","98","58081  >  443 [SYN] Seq=0 Win=65535 Len=0 MSS=1440 WS=64 TSval=1158631344 TSecr=0 SACK_PERM"
"34","0.868334","2620:149:a41:109::b","2601:19b:681:6a0:443d:6eeb:d343:8f85","QUIC","93","Protected Payload (KP0), DCID=b73eeb1283210ec8"
"35","0.869377","2620:149:a41:109::b","2601:19b:681:6a0:443d:6eeb:d343:8f85","QUIC","93","Protected Payload (KP0), DCID=b73eeb1283210ec8"
"36","0.869378","2620:149:a41:109::b","2601:19b:681:6a0:443d:6eeb:d343:8f85","QUIC","329","Protected Payload (KP0), DCID=b73eeb1283210ec8"
"37","0.888959","2620:149:a41:132::2:3","2601:19b:681:6a0:443d:6eeb:d343:8f85","TCP","94","443  >  58081 [SYN, ACK] Seq=0 Ack=1 Win=32844 Len=0 MSS=1440 SACK_PERM TSval=1664575663 TSecr=1158631344 WS=512"
"38","0.889829","2601:19b:681:6a0:443d:6eeb:d343:8f85","2620:149:a41:132::2:3","TCP","86","58081  >  443 [ACK] Seq=1 Ack=1 Win=131328 Len=0 TSval=1158631372 TSecr=1664575663"
"39","0.889832","2601:19b:681:6a0:443d:6eeb:d343:8f85","2620:149:a41:132::2:3","TLSv1.3","603","Client Hello (SNI=gateway.icloud.com)"
"40","0.895369","2601:19b:681:6a0:443d:6eeb:d343:8f85","2620:149:a41:109::b","QUIC","105","Protected Payload (KP0), DCID=387c1b349fb9402c0e1ae10db5522d81ec2adf44"
"41","0.915250","2620:149:a41:132::2:3","2601:19b:681:6a0:443d:6eeb:d343:8f85","TCP","86","443  >  58081 [ACK] Seq=1 Ack=518 Win=32768 Len=0 TSval=1664575699 TSecr=1158631372"
"42","0.915723","2620:149:a41:132::2:3","2601:19b:681:6a0:443d:6eeb:d343:8f85","TLSv1.3","1514","Server Hello, Change Cipher Spec, Application Data"
"43","0.916112","2620:149:a41:132::2:3","2601:19b:681:6a0:443d:6eeb:d343:8f85","TCP","1514","443  >  58081 [PSH, ACK] Seq=1429 Ack=518 Win=32768 Len=1428 TSval=1664575699 TSecr=1158631372 [TCP PDU reassembled in 49]"
"44","0.916422","2601:19b:681:6a0:443d:6eeb:d343:8f85","2620:149:a41:132::2:3","TCP","86","58081  >  443 [ACK] Seq=518 Ack=1429 Win=129920 Len=0 TSval=1158631398 TSecr=1664575699"
"45","0.916552","2601:19b:681:6a0:443d:6eeb:d343:8f85","2620:149:a41:132::2:3","TCP","86","58081  >  443 [ACK] Seq=518 Ack=2857 Win=129600 Len=0 TSval=1158631400 TSecr=1664575699"
"46","0.917202","2620:149:a41:132::2:3","2601:19b:681:6a0:443d:6eeb:d343:8f85","TCP","1326","443  >  58081 [PSH, ACK] Seq=2857 Ack=518 Win=32768 Len=1240 TSval=1664575699 TSecr=1158631372 [TCP PDU reassembled in 49]"
"47","0.917275","2601:19b:681:6a0:443d:6eeb:d343:8f85","2620:149:a41:132::2:3","TCP","86","58081  >  443 [ACK] Seq=518 Ack=4097 Win=129792 Len=0 TSval=1158631400 TSecr=1664575699"
"48","0.918212","2620:149:a41:132::2:3","2601:19b:681:6a0:443d:6eeb:d343:8f85","TCP","1514","443  >  58081 [ACK] Seq=4097 Ack=518 Win=32768 Len=1428 TSval=1664575699 TSecr=1158631372 [TCP PDU reassembled in 49]"
"49","0.918213","2620:149:a41:132::2:3","2601:19b:681:6a0:443d:6eeb:d343:8f85","TLSv1.3","579","Application Data, Application Data, Application Data"
"50","0.919157","2601:19b:681:6a0:443d:6eeb:d343:8f85","2620:149:a41:132::2:3","TCP","86","58081  >  443 [ACK] Seq=518 Ack=6018 Win=129088 Len=0 TSval=1158631401 TSecr=1664575699"
"51","0.930236","2601:19b:681:6a0:443d:6eeb:d343:8f85","2620:149:a41:132::2:3","TLSv1.3","150","Change Cipher Spec, Application Data"
"52","0.938612","2601:19b:681:6a0:443d:6eeb:d343:8f85","2620:149:a41:132::2:3","TLSv1.3","1397","Application Data"
"53","0.939390","2601:19b:681:6a0:443d:6eeb:d343:8f85","2620:149:a41:132::2:3","TLSv1.3","1141","Application Data"
"54","0.939928","2601:19b:681:6a0:443d:6eeb:d343:8f85","2620:149:a41:132::2:3","TLSv1.3","182","Application Data"
"55","0.940349","2601:19b:681:6a0:443d:6eeb:d343:8f85","2620:149:a41:132::2:3","TLSv1.3","117","Application Data"
"56","0.946419","2620:149:a41:132::2:3","2601:19b:681:6a0:443d:6eeb:d343:8f85","TLSv1.3","357","Application Data"
"57","0.946863","2601:19b:681:6a0:443d:6eeb:d343:8f85","2620:149:a41:132::2:3","TCP","86","58081  >  443 [ACK] Seq=3075 Ack=6289 Win=130752 Len=0 TSval=1158631430 TSecr=1664575731"
"58","0.947854","2620:149:a41:132::2:3","2601:19b:681:6a0:443d:6eeb:d343:8f85","TLSv1.3","357","Application Data"
"59","0.948057","2601:19b:681:6a0:443d:6eeb:d343:8f85","2620:149:a41:132::2:3","TCP","86","58081  >  443 [ACK] Seq=3075 Ack=6560 Win=130752 Len=0 TSval=1158631431 TSecr=1664575731"
"60","0.948707","2620:149:a41:132::2:3","2601:19b:681:6a0:443d:6eeb:d343:8f85","TLSv1.3","148","Application Data"
"61","0.948836","2601:19b:681:6a0:443d:6eeb:d343:8f85","2620:149:a41:132::2:3","TCP","86","58081  >  443 [ACK] Seq=3075 Ack=6622 Win=131008 Len=0 TSval=1158631431 TSecr=1664575731"
"62","0.948939","2601:19b:681:6a0:443d:6eeb:d343:8f85","2620:149:a41:132::2:3","TLSv1.3","117","Application Data"
"63","0.955897","2620:149:a41:132::2:3","2601:19b:681:6a0:443d:6eeb:d343:8f85","TLSv1.3","117","Application Data"
"64","0.956080","2601:19b:681:6a0:443d:6eeb:d343:8f85","2620:149:a41:132::2:3","TCP","86","58081  >  443 [ACK] Seq=3106 Ack=6653 Win=131008 Len=0 TSval=1158631439 TSecr=1664575740"
"65","0.965989","2620:149:a41:132::2:3","2601:19b:681:6a0:443d:6eeb:d343:8f85","TCP","86","443  >  58081 [ACK] Seq=6653 Ack=3075 Win=32256 Len=0 TSval=1664575748 TSecr=1158631422"
"66","1.004137","2601:19b:681:6a0:443d:6eeb:d343:8f85","2620:149:a41:132::2:3","TCP","117","[TCP Retransmission] 58081  >  443 [PSH, ACK] Seq=3075 Ack=6653 Win=131072 Len=31 TSval=1158631487 TSecr=1664575748"
"67","1.008132","2620:149:a41:132::2:3","2601:19b:681:6a0:443d:6eeb:d343:8f85","TCP","86","443  >  58081 [ACK] Seq=6653 Ack=3106 Win=32256 Len=0 TSval=1664575789 TSecr=1158631432"
"68","1.035070","2620:149:a41:132::2:3","2601:19b:681:6a0:443d:6eeb:d343:8f85","TCP","98","[TCP Dup ACK 67#1] 443  >  58081 [ACK] Seq=6653 Ack=3106 Win=32256 Len=0 TSval=1664575807 TSecr=1158631487 SLE=3075 SRE=3106"
"69","1.097596","2620:149:a41:132::2:3","2601:19b:681:6a0:443d:6eeb:d343:8f85","TLSv1.3","1065","Application Data"
"70","1.097899","2601:19b:681:6a0:443d:6eeb:d343:8f85","2620:149:a41:132::2:3","TCP","86","58081  >  443 [ACK] Seq=3106 Ack=7632 Win=130048 Len=0 TSval=1158631581 TSecr=1664575878"
"71","1.099563","2620:149:a41:132::2:3","2601:19b:681:6a0:443d:6eeb:d343:8f85","TLSv1.3","117","Application Data"
"72","1.099736","2601:19b:681:6a0:443d:6eeb:d343:8f85","2620:149:a41:132::2:3","TCP","86","58081  >  443 [ACK] Seq=3106 Ack=7663 Win=131008 Len=0 TSval=1158631583 TSecr=1664575878"
"73","1.115207","2601:19b:681:6a0:443d:6eeb:d343:8f85","2620:149:a41:132::2:3","TLSv1.3","219","Application Data"
"74","1.115475","2601:19b:681:6a0:443d:6eeb:d343:8f85","2620:149:a41:132::2:3","TLSv1.3","818","Application Data"
"75","1.115595","2601:19b:681:6a0:443d:6eeb:d343:8f85","2620:149:a41:132::2:3","TLSv1.3","117","Application Data"
"76","1.133500","2620:149:a41:132::2:3","2601:19b:681:6a0:443d:6eeb:d343:8f85","TCP","86","443  >  58081 [ACK] Seq=7663 Ack=3239 Win=32256 Len=0 TSval=1664575918 TSecr=1158631598"
"77","1.137302","2620:149:a41:132::2:3","2601:19b:681:6a0:443d:6eeb:d343:8f85","TCP","86","443  >  58081 [ACK] Seq=7663 Ack=3971 Win=32256 Len=0 TSval=1664575918 TSecr=1158631598"
"78","1.137303","2620:149:a41:132::2:3","2601:19b:681:6a0:443d:6eeb:d343:8f85","TCP","86","443  >  58081 [ACK] Seq=7663 Ack=4002 Win=32256 Len=0 TSval=1664575918 TSecr=1158631598"
"79","1.227082","2620:149:a41:132::2:3","2601:19b:681:6a0:443d:6eeb:d343:8f85","TCP","1514","443  >  58081 [ACK] Seq=7663 Ack=4002 Win=32256 Len=1428 TSval=1664576011 TSecr=1158631598 [TCP PDU reassembled in 80]"
"80","1.227084","2620:149:a41:132::2:3","2601:19b:681:6a0:443d:6eeb:d343:8f85","TLSv1.3","179","Application Data"
"81","1.227960","2601:19b:681:6a0:443d:6eeb:d343:8f85","2620:149:a41:132::2:3","TCP","86","58081  >  443 [ACK] Seq=4002 Ack=9184 Win=129536 Len=0 TSval=1158631711 TSecr=1664576011"
"82","1.757236","10.0.0.162","224.0.0.251","MDNS","100","Standard query 0x0000 PTR _rdlink._tcp.local, ""QU"" question PTR _companion-link._tcp.local, ""QU"" question"
"83","1.757468","fe80::1ce5:8f1:21fb:e65e","ff02::fb","MDNS","120","Standard query 0x0000 PTR _rdlink._tcp.local, ""QU"" question PTR _companion-link._tcp.local, ""QU"" question"
"84","1.890379","Apple_54:3b:69","fa:ab:16:1c:c8:5d","ARP","42","Who has 10.0.0.162? Tell 10.0.0.147"
"85","1.890382","10.0.0.147","10.0.0.162","MDNS","448","Standard query response 0x0000 PTR Mimanshaâ\200\231s MacBook Air._companion-link._tcp.local SRV, cache flush 0 0 50252 Mimanshas-MacBook-Air.local TXT, cache flush TXT AAAA, cache flush fe80::141f:f390:c528:a46c A, cache flush 10.0.0.147 AAAA, cache flush 2601:19b:681:6a0:1ca7:1eb9:7918:5256 AAAA, cache flush 2601:19b:681:6a0::c1be"
"86","1.898349","fa:ab:16:1c:c8:5d","Apple_54:3b:69","ARP","42","10.0.0.162 is at fa:ab:16:1c:c8:5d"
"87","2.170503","fe80::a2ff:70ff:fe23:f9a4","ff02::1","ICMPv6","174","Router Advertisement from a0:ff:70:23:f9:a4"
"88","2.781862","10.0.0.162","224.0.0.251","MDNS","139","Standard query 0x0000 PTR _rdlink._tcp.local, ""QM"" question PTR _companion-link._tcp.local, ""QM"" question PTR Mimanshaâ\200\231s MacBook Air._companion-link._tcp.local"
"89","2.781922","fe80::1ce5:8f1:21fb:e65e","ff02::fb","MDNS","159","Standard query 0x0000 PTR _rdlink._tcp.local, ""QM"" question PTR _companion-link._tcp.local, ""QM"" question PTR Mimanshaâ\200\231s MacBook Air._companion-link._tcp.local"
"90","3.607935","2a03:2880:f272:cc:face:b00c:0:43fe","2601:19b:681:6a0:443d:6eeb:d343:8f85","TLSv1.2","374","Application Data"
"91","3.608956","2601:19b:681:6a0:443d:6eeb:d343:8f85","2a03:2880:f272:cc:face:b00c:0:43fe","TCP","86","58063  >  443 [ACK] Seq=1 Ack=289 Win=2043 Len=0 TSval=1276806276 TSecr=702142010"
"92","3.615950","2601:19b:681:6a0:443d:6eeb:d343:8f85","2a03:2880:f272:cc:face:b00c:0:43fe","TLSv1.2","118","Application Data"
"93","3.624025","2a03:2880:f272:cc:face:b00c:0:43fe","2601:19b:681:6a0:443d:6eeb:d343:8f85","TCP","86","443  >  58063 [ACK] Seq=289 Ack=33 Win=632 Len=0 TSval=702142180 TSecr=1276806284"
"94","4.129058","2601:19b:681:6a0:443d:6eeb:d343:8f85","2a03:2880:f272:cc:face:b00c:0:43fe","TLSv1.2","116","Application Data"
"95","4.142334","2a03:2880:f272:cc:face:b00c:0:43fe","2601:19b:681:6a0:443d:6eeb:d343:8f85","TCP","86","443  >  58063 [ACK] Seq=289 Ack=63 Win=632 Len=0 TSval=702142697 TSecr=1276806797"
"96","4.220350","2601:19b:681:6a0:443d:6eeb:d343:8f85","2001:558:feed::1","DNS","113","Standard query 0xc85d HTTPS prod.roaming1.live.com.akadns.net"
"97","4.220602","2601:19b:681:6a0:443d:6eeb:d343:8f85","2001:558:feed::1","DNS","113","Standard query 0xb853 AAAA prod.roaming1.live.com.akadns.net"
"98","4.220850","2601:19b:681:6a0:443d:6eeb:d343:8f85","2001:558:feed::1","DNS","113","Standard query 0x7d97 A prod.roaming1.live.com.akadns.net"
"99","4.243568","2001:558:feed::1","2601:19b:681:6a0:443d:6eeb:d343:8f85","DNS","278","Standard query response 0xb853 AAAA prod.roaming1.live.com.akadns.net CNAME us1.roaming1.live.com.akadns.net CNAME eus2-azsc-000.roaming.officeapps.live.com CNAME osiprod-eus2-buff-azsc-000.eastus2.cloudapp.azure.com AAAA 2603:1036:2405::5"
"100","4.245481","2001:558:feed::1","2601:19b:681:6a0:443d:6eeb:d343:8f85","DNS","327","Standard query response 0xc85d HTTPS prod.roaming1.live.com.akadns.net CNAME us1.roaming1.live.com.akadns.net CNAME ncus-azsc-000.roaming.officeapps.live.com CNAME osiprod-ncus-buff-azsc-000.northcentralus.cloudapp.azure.com SOA ns1-02.azure-dns.com"
"101","4.245483","2001:558:feed::1","2601:19b:681:6a0:443d:6eeb:d343:8f85","DNS","266","Standard query response 0x7d97 A prod.roaming1.live.com.akadns.net CNAME us1.roaming1.live.com.akadns.net CNAME eus2-azsc-000.roaming.officeapps.live.com CNAME osiprod-eus2-buff-azsc-000.eastus2.cloudapp.azure.com A 52.109.6.63"
"102","4.245851","2601:19b:681:6a0:443d:6eeb:d343:8f85","2001:558:feed::1","DNS","133","Standard query 0xdaea HTTPS osiprod-eus2-buff-azsc-000.eastus2.cloudapp.azure.com"
"103","4.248300","2a03:2880:f272:cc:face:b00c:0:43fe","2601:19b:681:6a0:443d:6eeb:d343:8f85","TLSv1.2","114","Application Data"
"104","4.249039","2601:19b:681:6a0:443d:6eeb:d343:8f85","2a03:2880:f272:cc:face:b00c:0:43fe","TCP","86","58063  >  443 [ACK] Seq=63 Ack=317 Win=2047 Len=0 TSval=1276806916 TSecr=702142804"
"105","4.266338","2001:558:feed::1","2601:19b:681:6a0:443d:6eeb:d343:8f85","DNS","203","Standard query response 0xdaea HTTPS osiprod-eus2-buff-azsc-000.eastus2.cloudapp.azure.com SOA ns1-06.azure-dns.com"
"106","4.268131","2601:19b:681:6a0:443d:6eeb:d343:8f85","2603:1036:2405::5","TCP","98","58082  >  443 [SYN] Seq=0 Win=65535 Len=0 MSS=1440 WS=64 TSval=541540536 TSecr=0 SACK_PERM"
"107","4.304186","2603:1036:2405::5","2601:19b:681:6a0:443d:6eeb:d343:8f85","TCP","94","443  >  58082 [SYN, ACK] Seq=0 Ack=1 Win=65535 Len=0 MSS=1400 WS=256 SACK_PERM TSval=2403985679 TSecr=541540536"
"108","4.304526","2601:19b:681:6a0:443d:6eeb:d343:8f85","2603:1036:2405::5","TCP","86","58082  >  443 [ACK] Seq=1 Ack=1 Win=131840 Len=0 TSval=541540572 TSecr=2403985679"
"109","4.304528","2601:19b:681:6a0:443d:6eeb:d343:8f85","2603:1036:2405::5","TLSv1.2","603","Client Hello (SNI=roaming.officeapps.live.com)"
"110","4.347684","2603:1036:2405::5","2601:19b:681:6a0:443d:6eeb:d343:8f85","TCP","1514","443  >  58082 [ACK] Seq=1 Ack=518 Win=4194816 Len=1428 TSval=2403985723 TSecr=541540572 [TCP PDU reassembled in 116]"
"111","4.347993","2601:19b:681:6a0:443d:6eeb:d343:8f85","2603:1036:2405::5","TCP","86","58082  >  443 [ACK] Seq=518 Ack=1429 Win=130432 Len=0 TSval=541540616 TSecr=2403985723"
"112","4.348549","2603:1036:2405::5","2601:19b:681:6a0:443d:6eeb:d343:8f85","TCP","1514","443  >  58082 [ACK] Seq=1429 Ack=518 Win=4194816 Len=1428 TSval=2403985723 TSecr=541540572 [TCP PDU reassembled in 116]"
"113","4.348692","2601:19b:681:6a0:443d:6eeb:d343:8f85","2603:1036:2405::5","TCP","86","58082  >  443 [ACK] Seq=518 Ack=2857 Win=129600 Len=0 TSval=541540616 TSecr=2403985723"
"114","4.349638","2603:1036:2405::5","2601:19b:681:6a0:443d:6eeb:d343:8f85","TCP","1514","443  >  58082 [ACK] Seq=2857 Ack=518 Win=4194816 Len=1428 TSval=2403985723 TSecr=541540572 [TCP PDU reassembled in 116]"
"115","4.349640","2603:1036:2405::5","2601:19b:681:6a0:443d:6eeb:d343:8f85","TCP","1514","443  >  58082 [ACK] Seq=4285 Ack=518 Win=4194816 Len=1428 TSval=2403985723 TSecr=541540572 [TCP PDU reassembled in 116]"
"116","4.349641","2603:1036:2405::5","2601:19b:681:6a0:443d:6eeb:d343:8f85","TLSv1.2","593","Server Hello, Certificate, Certificate Status, Server Key Exchange, Server Hello Done"
"117","4.350308","2601:19b:681:6a0:443d:6eeb:d343:8f85","2603:1036:2405::5","TCP","86","58082  >  443 [ACK] Seq=518 Ack=6220 Win=131072 Len=0 TSval=541540618 TSecr=2403985723"
"118","4.357296","2601:19b:681:6a0:443d:6eeb:d343:8f85","2603:1036:2405::5","TLSv1.2","244","Client Key Exchange, Change Cipher Spec, Encrypted Handshake Message"
"119","4.391759","2603:1036:2405::5","2601:19b:681:6a0:443d:6eeb:d343:8f85","TLSv1.2","137","Change Cipher Spec, Encrypted Handshake Message"
"120","4.392391","2601:19b:681:6a0:443d:6eeb:d343:8f85","2603:1036:2405::5","TCP","86","58082  >  443 [ACK] Seq=676 Ack=6271 Win=131008 Len=0 TSval=541540660 TSecr=2403985758"
"121","4.392889","2601:19b:681:6a0:443d:6eeb:d343:8f85","2603:1036:2405::5","TLSv1.2","384","Application Data"
"122","4.393344","2601:19b:681:6a0:443d:6eeb:d343:8f85","2603:1036:2405::5","TCP","1474","58082  >  443 [ACK] Seq=974 Ack=6271 Win=131072 Len=1388 TSval=541540661 TSecr=2403985758 [TCP PDU reassembled in 131]"
"123","4.393346","2601:19b:681:6a0:443d:6eeb:d343:8f85","2603:1036:2405::5","TCP","1474","58082  >  443 [ACK] Seq=2362 Ack=6271 Win=131072 Len=1388 TSval=541540661 TSecr=2403985758 [TCP PDU reassembled in 131]"
"124","4.393347","2601:19b:681:6a0:443d:6eeb:d343:8f85","2603:1036:2405::5","TCP","1474","58082  >  443 [ACK] Seq=3750 Ack=6271 Win=131072 Len=1388 TSval=541540661 TSecr=2403985758 [TCP PDU reassembled in 131]"
"125","4.393349","2601:19b:681:6a0:443d:6eeb:d343:8f85","2603:1036:2405::5","TCP","1474","58082  >  443 [ACK] Seq=5138 Ack=6271 Win=131072 Len=1388 TSval=541540661 TSecr=2403985758 [TCP PDU reassembled in 131]"
"126","4.393350","2601:19b:681:6a0:443d:6eeb:d343:8f85","2603:1036:2405::5","TCP","1474","58082  >  443 [ACK] Seq=6526 Ack=6271 Win=131072 Len=1388 TSval=541540661 TSecr=2403985758 [TCP PDU reassembled in 131]"
"127","4.393351","2601:19b:681:6a0:443d:6eeb:d343:8f85","2603:1036:2405::5","TCP","1474","58082  >  443 [ACK] Seq=7914 Ack=6271 Win=131072 Len=1388 TSval=541540661 TSecr=2403985758 [TCP PDU reassembled in 131]"
"128","4.393351","2601:19b:681:6a0:443d:6eeb:d343:8f85","2603:1036:2405::5","TCP","1474","58082  >  443 [ACK] Seq=9302 Ack=6271 Win=131072 Len=1388 TSval=541540661 TSecr=2403985758 [TCP PDU reassembled in 131]"
"129","4.393352","2601:19b:681:6a0:443d:6eeb:d343:8f85","2603:1036:2405::5","TCP","1474","58082  >  443 [ACK] Seq=10690 Ack=6271 Win=131072 Len=1388 TSval=541540661 TSecr=2403985758 [TCP PDU reassembled in 131]"
"130","4.393353","2601:19b:681:6a0:443d:6eeb:d343:8f85","2603:1036:2405::5","TCP","1474","58082  >  443 [ACK] Seq=12078 Ack=6271 Win=131072 Len=1388 TSval=541540661 TSecr=2403985758 [TCP PDU reassembled in 131]"
"131","4.393367","2601:19b:681:6a0:443d:6eeb:d343:8f85","2603:1036:2405::5","TLSv1.2","1388","Application Data"
"132","4.396273","2603:1036:2405::5","2601:19b:681:6a0:443d:6eeb:d343:8f85","TLSv1.2","155","Application Data"
"133","4.396367","2601:19b:681:6a0:443d:6eeb:d343:8f85","2603:1036:2405::5","TCP","86","58082  >  443 [ACK] Seq=14768 Ack=6340 Win=130944 Len=0 TSval=541540664 TSecr=2403985769"
"134","4.396392","2601:19b:681:6a0:443d:6eeb:d343:8f85","2603:1036:2405::5","TLSv1.2","124","Application Data"
"135","4.426998","2603:1036:2405::5","2601:19b:681:6a0:443d:6eeb:d343:8f85","TLSv1.2","124","Application Data"
"136","4.427629","2601:19b:681:6a0:443d:6eeb:d343:8f85","2603:1036:2405::5","TCP","86","58082  >  443 [ACK] Seq=14806 Ack=6378 Win=131008 Len=0 TSval=541540695 TSecr=2403985804"
"137","4.435835","2603:1036:2405::5","2601:19b:681:6a0:443d:6eeb:d343:8f85","TCP","98","443  >  58082 [ACK] Seq=6378 Ack=9302 Win=4195328 Len=0 TSval=2403985813 TSecr=541540661 SLE=14768 SRE=14806"
"138","4.435929","2601:19b:681:6a0:443d:6eeb:d343:8f85","2603:1036:2405::5","TCP","1474","[TCP Retransmission] 58082  >  443 [ACK] Seq=9302 Ack=6378 Win=131072 Len=1388 TSval=541540704 TSecr=2403985813 [TCP PDU reassembled in 131]"
"139","4.435931","2601:19b:681:6a0:443d:6eeb:d343:8f85","2603:1036:2405::5","TCP","1474","[TCP Retransmission] 58082  >  443 [ACK] Seq=10690 Ack=6378 Win=131072 Len=1388 TSval=541540704 TSecr=2403985813 [TCP PDU reassembled in 131]"
"140","4.435932","2601:19b:681:6a0:443d:6eeb:d343:8f85","2603:1036:2405::5","TCP","1474","[TCP Retransmission] 58082  >  443 [ACK] Seq=12078 Ack=6378 Win=131072 Len=1388 TSval=541540704 TSecr=2403985813 [TCP PDU reassembled in 131]"
"141","4.435933","2601:19b:681:6a0:443d:6eeb:d343:8f85","2603:1036:2405::5","TCP","1388","[TCP Retransmission] 58082  >  443 [ACK] Seq=13466 Ack=6378 Win=131072 Len=1302 TSval=541540704 TSecr=2403985813 [TCP PDU reassembled in 131]"
"142","4.436292","2603:1036:2405::5","2601:19b:681:6a0:443d:6eeb:d343:8f85","TCP","98","443  >  58082 [ACK] Seq=6378 Ack=13466 Win=4195328 Len=0 TSval=2403985813 TSecr=541540661 SLE=14768 SRE=14806"
"143","4.436901","2603:1036:2405::5","2601:19b:681:6a0:443d:6eeb:d343:8f85","TCP","86","443  >  58082 [ACK] Seq=6378 Ack=14806 Win=4194048 Len=0 TSval=2403985813 TSecr=541540661"
"144","4.466198","20.50.73.4","10.0.0.147","TCP","54","443  >  63846 [RST, ACK] Seq=1 Ack=1 Win=0 Len=0"
"145","4.477274","2603:1036:2405::5","2601:19b:681:6a0:443d:6eeb:d343:8f85","TCP","98","[TCP Dup ACK 143#1] 443  >  58082 [ACK] Seq=6378 Ack=14806 Win=4194048 Len=0 TSval=2403985854 TSecr=541540695 SLE=9302 SRE=12078"
"146","4.477611","2603:1036:2405::5","2601:19b:681:6a0:443d:6eeb:d343:8f85","TCP","98","[TCP Dup ACK 143#2] 443  >  58082 [ACK] Seq=6378 Ack=14806 Win=4194048 Len=0 TSval=2403985855 TSecr=541540695 SLE=12078 SRE=13466"
"147","4.478194","2603:1036:2405::5","2601:19b:681:6a0:443d:6eeb:d343:8f85","TCP","98","[TCP Dup ACK 143#3] 443  >  58082 [ACK] Seq=6378 Ack=14806 Win=4194048 Len=0 TSval=2403985855 TSecr=541540695 SLE=13466 SRE=14768"
"148","4.572241","2603:1036:2405::5","2601:19b:681:6a0:443d:6eeb:d343:8f85","TLSv1.2","1070","Application Data"
"149","4.572372","2601:19b:681:6a0:443d:6eeb:d343:8f85","2603:1036:2405::5","TCP","86","58082  >  443 [ACK] Seq=14806 Ack=7362 Win=130048 Len=0 TSval=541540840 TSecr=2403985945"
"150","4.573059","2601:19b:681:6a0:443d:6eeb:d343:8f85","2603:1036:2405::5","TLSv1.2","132","Application Data"
"151","4.573186","2601:19b:681:6a0:443d:6eeb:d343:8f85","2603:1036:2405::5","TLSv1.2","117","Encrypted Alert"
"152","4.573301","2601:19b:681:6a0:443d:6eeb:d343:8f85","2603:1036:2405::5","TCP","86","58082  >  443 [FIN, ACK] Seq=14883 Ack=7362 Win=131072 Len=0 TSval=541540840 TSecr=2403985945"
"153","4.603376","2603:1036:2405::5","2601:19b:681:6a0:443d:6eeb:d343:8f85","TCP","86","443  >  58082 [ACK] Seq=7362 Ack=14852 Win=4194048 Len=0 TSval=2403985981 TSecr=541540840"
"154","4.604835","2603:1036:2405::5","2601:19b:681:6a0:443d:6eeb:d343:8f85","TCP","86","[TCP Dup ACK 153#1] 443  >  58082 [ACK] Seq=7362 Ack=14852 Win=4194048 Len=0 TSval=2403985981 TSecr=541540840"
"155","4.604836","2603:1036:2405::5","2601:19b:681:6a0:443d:6eeb:d343:8f85","TCP","86","443  >  58082 [ACK] Seq=7362 Ack=14884 Win=4193792 Len=0 TSval=2403985981 TSecr=541540840"
"156","4.604836","2603:1036:2405::5","2601:19b:681:6a0:443d:6eeb:d343:8f85","TLSv1.2","128","Application Data"
"157","4.604937","2601:19b:681:6a0:443d:6eeb:d343:8f85","2603:1036:2405::5","TCP","74","58082  >  443 [RST] Seq=14884 Win=0 Len=0"
"158","4.606279","2603:1036:2405::5","2601:19b:681:6a0:443d:6eeb:d343:8f85","TCP","86","443  >  58082 [FIN, ACK] Seq=7404 Ack=14884 Win=4193792 Len=0 TSval=2403985981 TSecr=541540840"
"159","4.606419","2601:19b:681:6a0:443d:6eeb:d343:8f85","2603:1036:2405::5","TCP","74","58082  >  443 [RST] Seq=14884 Win=0 Len=0"
"160","5.138123","fe80::a2ff:70ff:fe23:f9a4","ff02::1","ICMPv6","174","Router Advertisement from a0:ff:70:23:f9:a4"
"161","6.092981","2601:19b:681:6a0:443d:6eeb:d343:8f85","2a03:2880:f272:cc:face:b00c:0:43fe","TLSv1.2","370","Application Data"
"162","6.121091","2a03:2880:f272:cc:face:b00c:0:43fe","2601:19b:681:6a0:443d:6eeb:d343:8f85","TCP","86","443  >  58063 [ACK] Seq=317 Ack=347 Win=640 Len=0 TSval=702144674 TSecr=1276808761"
"163","6.225389","2a03:2880:f272:cc:face:b00c:0:43fe","2601:19b:681:6a0:443d:6eeb:d343:8f85","TLSv1.2","116","Application Data"
"164","6.225946","2601:19b:681:6a0:443d:6eeb:d343:8f85","2a03:2880:f272:cc:face:b00c:0:43fe","TCP","86","58063  >  443 [ACK] Seq=347 Ack=347 Win=2047 Len=0 TSval=1276808894 TSecr=702144781"
"165","6.239026","2a03:2880:f272:cc:face:b00c:0:43fe","2601:19b:681:6a0:443d:6eeb:d343:8f85","TLSv1.2","129","Application Data"
"166","6.239480","2601:19b:681:6a0:443d:6eeb:d343:8f85","2a03:2880:f272:cc:face:b00c:0:43fe","TCP","86","58063  >  443 [ACK] Seq=347 Ack=390 Win=2047 Len=0 TSval=1276808907 TSecr=702144794"
"167","7.558914","2601:19b:681:6a0:443d:6eeb:d343:8f85","2607:f8b0:4006:80c::200e","UDP","91","58082  >  443 Len=29"
"168","7.588038","2607:f8b0:4006:80c::200e","2601:19b:681:6a0:443d:6eeb:d343:8f85","UDP","92","443  >  58082 Len=30"
"169","8.086448","2601:19b:681:6a0:443d:6eeb:d343:8f85","2620:149:a41:109::a","UDP","92","52107  >  443 Len=30"
"170","8.108922","fe80::a2ff:70ff:fe23:f9a4","ff02::1","ICMPv6","174","Router Advertisement from a0:ff:70:23:f9:a4"
"171","8.136064","2620:149:a41:109::a","2601:19b:681:6a0:443d:6eeb:d343:8f85","UDP","95","443  >  52107 Len=33"
"172","8.518573","2601:19b:681:6a0:443d:6eeb:d343:8f85","2607:f8b0:4004:c1d::6c","TLSv1.2","121","Application Data"
"173","8.518576","2601:19b:681:6a0:443d:6eeb:d343:8f85","2607:f8b0:4004:c1d::6c","TLSv1.2","121","Application Data"
"174","8.549131","2607:f8b0:4004:c1d::6c","2601:19b:681:6a0:443d:6eeb:d343:8f85","TCP","86","993  >  50035 [ACK] Seq=1 Ack=36 Win=1053 Len=0 TSval=2094497772 TSecr=3800576911"
"175","8.554314","2607:f8b0:4004:c1d::6c","2601:19b:681:6a0:443d:6eeb:d343:8f85","TCP","86","993  >  50023 [ACK] Seq=1 Ack=36 Win=1053 Len=0 TSval=1632858921 TSecr=1248529316"
"176","8.568607","2607:f8b0:4004:c1d::6c","2601:19b:681:6a0:443d:6eeb:d343:8f85","TLSv1.2","149","Application Data"
"177","8.568789","2601:19b:681:6a0:443d:6eeb:d343:8f85","2607:f8b0:4004:c1d::6c","TCP","86","50023  >  993 [ACK] Seq=36 Ack=64 Win=1999 Len=0 TSval=1248529367 TSecr=1632858935"
"178","8.569854","2607:f8b0:4004:c1d::6c","2601:19b:681:6a0:443d:6eeb:d343:8f85","TLSv1.2","118","Application Data"
"179","8.569940","2601:19b:681:6a0:443d:6eeb:d343:8f85","2607:f8b0:4004:c1d::6c","TCP","86","50023  >  993 [ACK] Seq=36 Ack=96 Win=1998 Len=0 TSval=1248529368 TSecr=1632858935"
"180","8.570320","2601:19b:681:6a0:443d:6eeb:d343:8f85","2607:f8b0:4004:c1d::6c","TLSv1.2","141","Application Data"
"181","8.599178","2607:f8b0:4004:c1d::6c","2601:19b:681:6a0:443d:6eeb:d343:8f85","TCP","86","993  >  50023 [ACK] Seq=96 Ack=91 Win=1053 Len=0 TSval=1632858965 TSecr=1248529368"
"182","8.610566","2607:f8b0:4004:c1d::6c","2601:19b:681:6a0:443d:6eeb:d343:8f85","TLSv1.2","134","Application Data"
"183","8.610647","2601:19b:681:6a0:443d:6eeb:d343:8f85","2607:f8b0:4004:c1d::6c","TCP","86","50023  >  993 [ACK] Seq=91 Ack=144 Win=1997 Len=0 TSval=1248529409 TSecr=1632858978"
"184","8.612995","2601:19b:681:6a0:443d:6eeb:d343:8f85","2607:f8b0:4004:c1d::6c","TLSv1.2","128","Application Data"
"185","8.619061","2607:f8b0:4004:c1d::6c","2601:19b:681:6a0:443d:6eeb:d343:8f85","TLSv1.2","149","Application Data"
"186","8.619177","2601:19b:681:6a0:443d:6eeb:d343:8f85","2607:f8b0:4004:c1d::6c","TCP","86","50035  >  993 [ACK] Seq=36 Ack=64 Win=1999 Len=0 TSval=3800577012 TSecr=2094497840"
"187","8.619561","2607:f8b0:4004:c1d::6c","2601:19b:681:6a0:443d:6eeb:d343:8f85","TLSv1.2","118","Application Data"
"188","8.619608","2601:19b:681:6a0:443d:6eeb:d343:8f85","2607:f8b0:4004:c1d::6c","TCP","86","50035  >  993 [ACK] Seq=36 Ack=96 Win=1999 Len=0 TSval=3800577012 TSecr=2094497840"
"189","8.619850","2601:19b:681:6a0:443d:6eeb:d343:8f85","2607:f8b0:4004:c1d::6c","TLSv1.2","141","Application Data"
"190","8.642356","2607:f8b0:4004:c1d::6c","2601:19b:681:6a0:443d:6eeb:d343:8f85","TCP","86","993  >  50023 [ACK] Seq=144 Ack=133 Win=1053 Len=0 TSval=1632859009 TSecr=1248529411"
"191","8.645509","2607:f8b0:4004:c1d::6c","2601:19b:681:6a0:443d:6eeb:d343:8f85","TCP","86","993  >  50035 [ACK] Seq=96 Ack=91 Win=1053 Len=0 TSval=2094497869 TSecr=3800577012"
"192","8.645510","2607:f8b0:4004:c1d::6c","2601:19b:681:6a0:443d:6eeb:d343:8f85","TCP","86","[TCP Dup ACK 191#1] 993  >  50035 [ACK] Seq=96 Ack=91 Win=1053 Len=0 TSval=2094497869 TSecr=3800577012"
"193","8.655488","2607:f8b0:4004:c1d::6c","2601:19b:681:6a0:443d:6eeb:d343:8f85","TLSv1.2","125","Application Data"
"194","8.655579","2601:19b:681:6a0:443d:6eeb:d343:8f85","2607:f8b0:4004:c1d::6c","TCP","86","50023  >  993 [ACK] Seq=133 Ack=183 Win=1997 Len=0 TSval=1248529454 TSecr=1632859022"
"195","8.656243","2601:19b:681:6a0:443d:6eeb:d343:8f85","2607:f8b0:4004:c1d::6c","TLSv1.2","121","Application Data"
"196","8.690170","2607:f8b0:4004:c1d::6c","2601:19b:681:6a0:443d:6eeb:d343:8f85","TCP","86","993  >  50023 [ACK] Seq=183 Ack=168 Win=1053 Len=0 TSval=1632859057 TSecr=1248529454"
"197","8.707332","2607:f8b0:4004:c1d::6c","2601:19b:681:6a0:443d:6eeb:d343:8f85","TLSv1.2","133","Application Data"
"198","8.707415","2601:19b:681:6a0:443d:6eeb:d343:8f85","2607:f8b0:4004:c1d::6c","TCP","86","50023  >  993 [ACK] Seq=168 Ack=230 Win=1996 Len=0 TSval=1248529505 TSecr=1632859070"
"199","8.707683","2607:f8b0:4004:c1d::6c","2601:19b:681:6a0:443d:6eeb:d343:8f85","TLSv1.2","134","Application Data"
"200","8.707742","2601:19b:681:6a0:443d:6eeb:d343:8f85","2607:f8b0:4004:c1d::6c","TCP","86","50023  >  993 [ACK] Seq=168 Ack=278 Win=1995 Len=0 TSval=1248529505 TSecr=1632859070"
"201","8.708216","2601:19b:681:6a0:443d:6eeb:d343:8f85","2607:f8b0:4004:c1d::6c","TLSv1.2","129","Application Data"
"202","8.714588","2607:f8b0:4004:c1d::6c","2601:19b:681:6a0:443d:6eeb:d343:8f85","TLSv1.2","134","Application Data"
"203","8.714700","2601:19b:681:6a0:443d:6eeb:d343:8f85","2607:f8b0:4004:c1d::6c","TCP","86","50035  >  993 [ACK] Seq=91 Ack=144 Win=1998 Len=0 TSval=3800577108 TSecr=2094497938"
"204","8.722301","2601:19b:681:6a0:443d:6eeb:d343:8f85","2607:f8b0:4004:c1d::6c","TLSv1.2","128","Application Data"
"205","8.743394","2607:f8b0:4004:c1d::6c","2601:19b:681:6a0:443d:6eeb:d343:8f85","TCP","86","993  >  50023 [ACK] Seq=278 Ack=211 Win=1053 Len=0 TSval=1632859107 TSecr=1248529505"
"206","8.752211","2607:f8b0:4004:c1d::6c","2601:19b:681:6a0:443d:6eeb:d343:8f85","TCP","86","993  >  50035 [ACK] Seq=144 Ack=133 Win=1053 Len=0 TSval=2094497976 TSecr=3800577115"
"207","8.753041","2607:f8b0:4004:c1d::6c","2601:19b:681:6a0:443d:6eeb:d343:8f85","TLSv1.2","134","Application Data"
"208","8.753117","2601:19b:681:6a0:443d:6eeb:d343:8f85","2607:f8b0:4004:c1d::6c","TCP","86","50023  >  993 [ACK] Seq=211 Ack=326 Win=1995 Len=0 TSval=1248529550 TSecr=1632859119"
"209","8.753877","2601:19b:681:6a0:443d:6eeb:d343:8f85","2607:f8b0:4004:c1d::6c","TLSv1.2","167","Application Data"
"210","8.780928","2607:f8b0:4004:c1d::6c","2601:19b:681:6a0:443d:6eeb:d343:8f85","TCP","86","993  >  50023 [ACK] Seq=326 Ack=292 Win=1053 Len=0 TSval=1632859147 TSecr=1248529552"
"211","8.799607","2607:f8b0:4004:c1d::6c","2601:19b:681:6a0:443d:6eeb:d343:8f85","TLSv1.2","149","Application Data"
"212","8.799761","2601:19b:681:6a0:443d:6eeb:d343:8f85","2607:f8b0:4004:c1d::6c","TCP","86","50023  >  993 [ACK] Seq=292 Ack=389 Win=1994 Len=0 TSval=1248529598 TSecr=1632859165"
"213","8.799921","2607:f8b0:4004:c1d::6c","2601:19b:681:6a0:443d:6eeb:d343:8f85","TLSv1.2","161","Application Data"
"214","8.800013","2601:19b:681:6a0:443d:6eeb:d343:8f85","2607:f8b0:4004:c1d::6c","TCP","86","50023  >  993 [ACK] Seq=292 Ack=464 Win=1992 Len=0 TSval=1248529598 TSecr=1632859165"
"215","8.803708","2601:19b:681:6a0:443d:6eeb:d343:8f85","2607:f8b0:4004:c1d::6c","TLSv1.2","128","Application Data"
"216","8.823408","2607:f8b0:4004:c1d::6c","2601:19b:681:6a0:443d:6eeb:d343:8f85","TLSv1.2","125","Application Data"
"217","8.823538","2601:19b:681:6a0:443d:6eeb:d343:8f85","2607:f8b0:4004:c1d::6c","TCP","86","50035  >  993 [ACK] Seq=133 Ack=183 Win=1998 Len=0 TSval=3800577216 TSecr=2094498044"
"218","8.825536","2601:19b:681:6a0:443d:6eeb:d343:8f85","2607:f8b0:4004:c1d::6c","TLSv1.2","121","Application Data"
"219","8.829897","2607:f8b0:4004:c1d::6c","2601:19b:681:6a0:443d:6eeb:d343:8f85","TCP","86","993  >  50023 [ACK] Seq=464 Ack=334 Win=1053 Len=0 TSval=1632859197 TSecr=1248529602"
"220","8.846037","2607:f8b0:4004:c1d::6c","2601:19b:681:6a0:443d:6eeb:d343:8f85","TLSv1.2","125","Application Data"
"221","8.846201","2601:19b:681:6a0:443d:6eeb:d343:8f85","2607:f8b0:4004:c1d::6c","TCP","86","50023  >  993 [ACK] Seq=334 Ack=503 Win=1992 Len=0 TSval=1248529644 TSecr=1632859210"
"222","8.848564","2607:f8b0:4004:c1d::6c","2601:19b:681:6a0:443d:6eeb:d343:8f85","TCP","86","993  >  50035 [ACK] Seq=183 Ack=168 Win=1053 Len=0 TSval=2094498072 TSecr=3800577218"
"223","8.882437","2601:19b:681:6a0:443d:6eeb:d343:8f85","2603:1036:302:415f::2","TCP","74","58070  >  443 [RST] Seq=1 Win=0 Len=0"
"224","8.882518","2601:19b:681:6a0:443d:6eeb:d343:8f85","2603:1036:303:3c34::2","TCP","74","58077  >  443 [RST] Seq=1 Win=0 Len=0"
"225","8.882542","2601:19b:681:6a0:443d:6eeb:d343:8f85","2603:1036:303:3c34::2","TCP","74","58075  >  443 [RST] Seq=1 Win=0 Len=0"
"226","8.916033","2607:f8b0:4004:c1d::6c","2601:19b:681:6a0:443d:6eeb:d343:8f85","TLSv1.2","133","Application Data"
"227","8.916199","2601:19b:681:6a0:443d:6eeb:d343:8f85","2607:f8b0:4004:c1d::6c","TCP","86","50035  >  993 [ACK] Seq=168 Ack=230 Win=1997 Len=0 TSval=3800577309 TSecr=2094498139"
"228","8.916408","2607:f8b0:4004:c1d::6c","2601:19b:681:6a0:443d:6eeb:d343:8f85","TLSv1.2","134","Application Data"
"229","8.916510","2601:19b:681:6a0:443d:6eeb:d343:8f85","2607:f8b0:4004:c1d::6c","TCP","86","50035  >  993 [ACK] Seq=168 Ack=278 Win=1996 Len=0 TSval=3800577309 TSecr=2094498139"
"230","8.917495","2601:19b:681:6a0:443d:6eeb:d343:8f85","2607:f8b0:4004:c1d::6c","TLSv1.2","129","Application Data"
"231","8.944028","2607:f8b0:4004:c1d::6c","2601:19b:681:6a0:443d:6eeb:d343:8f85","TCP","86","993  >  50035 [ACK] Seq=278 Ack=211 Win=1053 Len=0 TSval=2094498166 TSecr=3800577310"
"232","9.010062","2607:f8b0:4004:c1d::6c","2601:19b:681:6a0:443d:6eeb:d343:8f85","TLSv1.2","134","Application Data"
"233","9.010229","2601:19b:681:6a0:443d:6eeb:d343:8f85","2607:f8b0:4004:c1d::6c","TCP","86","50035  >  993 [ACK] Seq=211 Ack=326 Win=1995 Len=0 TSval=3800577403 TSecr=2094498234"
"234","9.011440","2601:19b:681:6a0:443d:6eeb:d343:8f85","2607:f8b0:4004:c1d::6c","TLSv1.2","167","Application Data"
"235","9.036082","2607:f8b0:4004:c1d::6c","2601:19b:681:6a0:443d:6eeb:d343:8f85","TCP","86","993  >  50035 [ACK] Seq=326 Ack=292 Win=1053 Len=0 TSval=2094498260 TSecr=3800577404"
"236","9.105898","2607:f8b0:4004:c1d::6c","2601:19b:681:6a0:443d:6eeb:d343:8f85","TLSv1.2","149","Application Data"
"237","9.106028","2601:19b:681:6a0:443d:6eeb:d343:8f85","2607:f8b0:4004:c1d::6c","TCP","86","50035  >  993 [ACK] Seq=292 Ack=389 Win=1994 Len=0 TSval=3800577499 TSecr=2094498328"
"238","9.106180","2607:f8b0:4004:c1d::6c","2601:19b:681:6a0:443d:6eeb:d343:8f85","TLSv1.2","161","Application Data"
"239","9.106253","2601:19b:681:6a0:443d:6eeb:d343:8f85","2607:f8b0:4004:c1d::6c","TCP","86","50035  >  993 [ACK] Seq=292 Ack=464 Win=1993 Len=0 TSval=3800577499 TSecr=2094498328"
"240","9.109506","2601:19b:681:6a0:443d:6eeb:d343:8f85","2607:f8b0:4004:c1d::6c","TLSv1.2","128","Application Data"
"241","9.135601","2607:f8b0:4004:c1d::6c","2601:19b:681:6a0:443d:6eeb:d343:8f85","TCP","86","993  >  50035 [ACK] Seq=464 Ack=334 Win=1053 Len=0 TSval=2094498354 TSecr=3800577502"
"242","9.197951","2607:f8b0:4004:c1d::6c","2601:19b:681:6a0:443d:6eeb:d343:8f85","TLSv1.2","125","Application Data"
"243","9.198024","2601:19b:681:6a0:443d:6eeb:d343:8f85","2607:f8b0:4004:c1d::6c","TCP","86","50035  >  993 [ACK] Seq=334 Ack=503 Win=1993 Len=0 TSval=3800577591 TSecr=2094498422"
"244","9.748403","VantivaUSA_23:f9:a4","Apple_54:3b:69","ARP","42","Who has 10.0.0.147? Tell 10.0.0.1"
"245","9.748491","Apple_54:3b:69","VantivaUSA_23:f9:a4","ARP","42","10.0.0.147 is at a8:8f:d9:54:3b:69"
